{
    "$schema": "http://json-schema.org/draft-07/schema#",
    "type": "array",
    "items": {
      "type": "object",
      "properties": {
        "_id": {
          "type": "string"
        },
        "place": {
          "type": "string"
        },
        "timestamp": {
          "type": "string",
          "format": "date-time"
        },
        "attractions": {
          "type": "array",
          "items": {
            "type": "object",
            "properties": {
              "lat": {
                "type": "number"
              },
              "lon": {
                "type": "number"
              },
              "name": {
                "type": "string"
              }
            },
            "required": ["lat", "lon", "name"]
          }
        }
      },
      "required": ["_id", "place", "timestamp", "attractions"]
    }
  }  